### ISSUE TITLE
Flannel MTU doesn't include wireguard header for communication between regions

### ISSUE THREAD

**Issue by ogrand** [orange-cloudfoundry/paas-templates#2202]
### Expected behavior

* As a paas-templates operator
* In order to avoid ip datagram fragmentation
* I need to set MTU over flannel interfaces over k8s servers wich use nodes overs different regions

### Observed behavior

tcpdump over vpn instance `wg0` interface shows that exchange between `ha-datastore` pods using `flannel` (10.42.xxx subnets) over `wireguard` generate ip fragmentation, because it does'nt take account of wireguard 80 bytes overhead :

```
vpn# tcpdump -ni wg0 | grep "IP truncated"
IP truncated-ip - 80 bytes missing! 10.42.0.20.5432 > 10.42.1.19.48484: Flags [.], seq 11097069:11098467, ack 1150, win 501, options [nop,nop,TS val 2116440186 ecr 563056576], length 1398
IP truncated-ip - 80 bytes missing! 10.42.0.20.5432 > 10.42.1.19.48484: Flags [.], seq 11098467:11099865, ack 1150, win 501, options [nop,nop,TS val 2116440186 ecr 563056576], length 1398
IP truncated-ip - 80 bytes missing! 10.42.0.20.5432 > 10.42.1.19.48484: Flags [P.], seq 11099865:11101263, ack 1150, win 501, options [nop,nop,TS val 2116440186 ecr 563056576], length 1398
IP truncated-ip - 80 bytes missing! 10.42.0.20.5432 > 10.42.2.14.47444: Flags [.], seq 11752159:11753557, ack 877, win 560, options [nop,nop,TS val 3396110980 ecr 1101367388], length 1398
IP truncated-ip - 80 bytes missing! 10.42.0.20.5432 > 10.42.2.14.47444: Flags [.], seq 11753557:11754955, ack 877, win 560, options [nop,nop,TS val 3396110980 ecr 1101367388], length 1398
``` 

Manually setting vxlan `flannel.1` interface mtu to 1370 (1450 - 80 = 1370) on `00-k8s-ha-datastore` server instances disable tcpdump truncated-ip messages

```
server# ip link set mtu 1370 up dev flannel.1 ; ip link show dev flannel.1
3: flannel.1: <BROADCAST,MULTICAST,UP,LOWER_UP> mtu 1370 qdisc noqueue state UNKNOWN mode DEFAULT group default
```

- Datagrams volume decrease with MTU=1370 and increase with MTU=1450

![image](https://github.com/orange-cloudfoundry/paas-templates/assets/26904966/99409f70-295c-400b-92d5-58a255756e7a)

- **netstat -s** analysis confirm this point (preproduction: v56, production: v55):

![image](https://github.com/orange-cloudfoundry/paas-templates/assets/26904966/77bf90d2-a07f-40ae-98e1-ff594f1333d5)

### Possible fix

We should fix this behavior by setting mtu on `flannel.1` interface to 1370 for `ha-datastore` cluster only

* [ ]  Observability 

Related snmp metrics from https://loicpefferkorn.net/2018/09/linux-network-statistics-reference/
![image](https://github.com/orange-cloudfoundry/paas-templates/assets/4748380/271ca58c-706b-4b1e-b91d-366d40184ccb)

```
cat /proc/net/snmp | grep Ip
Ip: Forwarding DefaultTTL InReceives InHdrErrors InAddrErrors ForwDatagrams InUnknownProtos InDiscards InDelivers OutRequests OutDiscards OutNoRoutes ReasmTimeout ReasmReqds ReasmOKs ReasmFails FragOKs FragFails FragCreates
Ip: 1 64 1672944402 24576 31079 1032975323 0 0 605304988 1516771025 289 0 298589 68846659 34273942 298716 36199397 35401 72398905
\\\

```
"^(.*_(InErrors|InErrs)|Ip_Forwarding|Ip(6|Ext)_(InOctets|OutOctets)|Icmp6?_(InMsgs|OutMsgs)|TcpExt_(Listen.*|Syncookies.*|TCPSynRetrans|TCPTimeouts)|Tcp_(ActiveOpens|InSegs|OutSegs|OutRsts|PassiveOpens|RetransSegs|CurrEstab)|Udp6?_(InDatagrams|OutDatagrams|NoPorts|RcvbufErrors|SndbufErrors))$"
```

```
"^(.*_(InErrors|InErrs)|Ip_(Forwarding||Reasm)|Ip(6|Ext)_(InOctets|OutOctets)|Icmp6?_(InMsgs|OutMsgs)|TcpExt_(Listen.*|Syncookies.*|TCPSynRetrans|TCPTimeouts)|Tcp_(ActiveOpens|InSegs|OutSegs|OutRsts|PassiveOpens|RetransSegs|CurrEstab)|Udp6?_(InDatagrams|OutDatagrams|NoPorts|RcvbufErrors|SndbufErrors))$"
```

translates into node exporter flag according to https://github.com/prometheus/node_exporter/issues/2179#issuecomment-953763791

>  --collector.netstat.fields=...|Ip_(Forwarding|OutNoRoutes)|...


``` --collector.netstat.fields='^(.*_(InErrors|InErrs)|Ip_Forwarding|Ip(6|Ext)_(InOctets|OutOctets)|Icmp6?_(InMsgs|OutMsgs)|TcpExt_(Listen.*|Syncookies.*|TCPSynRetrans|TCPTimeouts)|Tcp_(ActiveOpens|InSegs|OutSegs|OutRsts|PassiveOpens|RetransSegs|CurrEstab)|Udp6?_(InDatagrams|OutDatagrams|NoPorts|RcvbufErrors|SndbufErrors))$'
```

```diff
diff /var/vcap/jobs/node_exporter/bin/node_exporter_ctl  /var/vcap/jobs/node_exporter/bin/node_exporter_ctl.bck 
27,28c27
<        --collector.netstat.fields='^(.*_(InErrors|InErrs)|Ip_(Forwarding|Reasm.*|Frag.*)|Ip(6|Ext)_(InOctets|OutOctets)|Icmp6?_(InMsgs|OutMsgs)|TcpExt_(Listen.*|Syncookies.*|TCPSynRetrans|TCPTimeouts)|Tcp_(ActiveOpens|InSegs|OutSegs|OutRsts|PassiveOpens|RetransSegs|CurrEstab)|Udp6?_(InDatagrams|OutDatagrams|NoPorts|RcvbufErrors|SndbufErrors))$' \
<  \
---
>        \
```

### References
- https://www.baeldung.com/cs/ip-fragmentation-reassembly
- https://loicpefferkorn.net/2018/09/linux-network-statistics-reference/#ip
- https://addozhang.medium.com/learning-kubernetes-vxlan-network-with-flannel-2d6a58c95300

### Affected releases

* 56

**Comment by poblin-orange** [comment]
switched ops-depls/00-k8s-ha-datastore to cilium vxlan (looks like stock flannel/vxlan in k3s is different of cilium/vxlan config)
